{
  "contract": {
    "kind": "denova.quality-profile",
    "version": "v1",
    "issued_at": "2026-07-21T09:00:00+08:00"
  },
  "profile_id": "long_serial",
  "display_name": {
    "zh-CN": "长篇连载",
    "en": "Long serial"
  },
  "engine_contract": {
    "engine_id": "denova.shared-quality-engine",
    "contract_version": "v1",
    "implementation_branching": "profile_data_only"
  },
  "profile_provenance": {
    "source_id": "plan-p0-t04-20260721",
    "source_kind": "approved_plan",
    "source_ref": "PHASE_0_DETAILED_PLAN.md#P0-T04",
    "observed_at": "2026-07-21",
    "effective_from": "2026-07-21",
    "recorded_at": "2026-07-21T09:00:00+08:00"
  },
  "identity_policy": {
    "unknown_profile_id": "reject_explicitly",
    "silent_fallback": false,
    "model_mutation": "candidate_only"
  },
  "settings": {
    "required_artifacts": [
      {
        "id": "artifacts.chapter_context",
        "value": ["setting/chapter-12-plan.md", "chapters/0012.md"],
        "provenance": {
          "source_id": "plan-p0-t04-20260721",
          "source_kind": "approved_plan",
          "source_ref": "Profile v1 long serial walkthrough",
          "observed_at": "2026-07-21",
          "effective_from": "2026-07-21",
          "recorded_at": "2026-07-21T09:00:00+08:00"
        },
        "author_override_policy": {
          "allowed": true,
          "allowed_scopes": ["project", "task", "operation_confirmation"],
          "requires_explicit_confirmation": true,
          "unsupported_value_policy": "reject_explicitly"
        }
      }
    ],
    "required_capabilities": [
      {
        "id": "capabilities.serial_continuity",
        "value": ["continuity.check", "chapter.progress"],
        "provenance": {
          "source_id": "plan-p0-t04-20260721",
          "source_kind": "approved_plan",
          "source_ref": "Profile v1 long serial capability defaults",
          "observed_at": "2026-07-21",
          "effective_from": "2026-07-21",
          "recorded_at": "2026-07-21T09:00:00+08:00"
        },
        "author_override_policy": {
          "allowed": true,
          "allowed_scopes": ["project", "task"],
          "requires_explicit_confirmation": true,
          "unsupported_value_policy": "reject_explicitly"
        }
      }
    ],
    "candidate_policy": [
      {
        "id": "candidates.chapter_draft_count",
        "value": 1,
        "provenance": {
          "source_id": "plan-p0-t04-20260721",
          "source_kind": "approved_plan",
          "source_ref": "Profile v1 minimum viable candidate policy",
          "observed_at": "2026-07-21",
          "effective_from": "2026-07-21",
          "recorded_at": "2026-07-21T09:00:00+08:00"
        },
        "author_override_policy": {
          "allowed": true,
          "allowed_scopes": ["task", "operation_confirmation"],
          "requires_explicit_confirmation": true,
          "unsupported_value_policy": "reject_explicitly"
        }
      }
    ],
    "review_rubric": [
      {
        "id": "review.serial_continuity",
        "value": ["state_consistency", "setup_payoff", "chapter_progress"],
        "provenance": {
          "source_id": "plan-p0-t04-20260721",
          "source_kind": "approved_plan",
          "source_ref": "Profile v1 long serial review focus",
          "observed_at": "2026-07-21",
          "effective_from": "2026-07-21",
          "recorded_at": "2026-07-21T09:00:00+08:00"
        },
        "author_override_policy": {
          "allowed": true,
          "allowed_scopes": ["project", "task", "operation_confirmation"],
          "requires_explicit_confirmation": true,
          "unsupported_value_policy": "reject_explicitly"
        }
      }
    ],
    "export_config": [
      {
        "id": "export.chapter_markdown",
        "value": { "format": "markdown", "target": "chapters/0012.md" },
        "provenance": {
          "source_id": "plan-p0-t04-20260721",
          "source_kind": "approved_plan",
          "source_ref": "Workspace Schema v1 chapter path",
          "observed_at": "2026-07-21",
          "effective_from": "2026-07-21",
          "recorded_at": "2026-07-21T09:00:00+08:00"
        },
        "author_override_policy": {
          "allowed": true,
          "allowed_scopes": ["project", "task"],
          "requires_explicit_confirmation": true,
          "unsupported_value_policy": "reject_explicitly"
        }
      }
    ]
  },
  "walkthrough": {
    "operation_id": "draft_chapter_12",
    "artifact_ref": "chapters/0012.md",
    "description": {
      "zh-CN": "为长篇连载起草第 12 章，并以已确认的严格连续性合同检查人物状态、伏笔与章节推进。",
      "en": "Draft chapter 12 of a long serial and check character state, setups, and progress under the confirmed strict-continuity contract."
    },
    "evaluation_focus": ["qg.serial.continuity", "qg.serial.chapter_end_momentum"]
  },
  "quality_spec": {
    "contract": {
      "kind": "denova.quality-spec",
      "version": "v1",
      "issued_at": "2026-07-21T09:10:00+08:00"
    },
    "spec_id": "qs-long-serial-chapter-12",
    "revision": 1,
    "profile_id": "long_serial",
    "goal_catalog": [
      {
        "id": "qg.serial.continuity",
        "contract": { "kind": "denova.quality-goal", "version": "v1" },
        "description": {
          "zh-CN": "第 12 章与既有角色状态、设定和伏笔保持连续。",
          "en": "Chapter 12 remains continuous with established character state, lore, and setups."
        },
        "source": {
          "source_id": "profile-long-serial-v1",
          "source_kind": "profile_contract",
          "source_ref": "ADR-PROFILE-001#long-serial",
          "observed_at": "2026-07-21",
          "effective_from": "2026-07-21",
          "recorded_at": "2026-07-21T09:10:00+08:00"
        },
        "purpose": {
          "zh-CN": "防止连续多章创作中的状态漂移与无依据改写。",
          "en": "Prevent state drift and unsupported rewrites across serial chapters."
        },
        "scope": {
          "profile_ids": ["long_serial"],
          "operation_ids": ["draft_chapter_12"],
          "artifact_types": ["chapter_draft"]
        },
        "priority": "must",
        "evidence_requirement": {
          "kind": "source_crosscheck",
          "description": {
            "zh-CN": "至少引用一处章节文本与一处大纲、设定或前章状态证据。",
            "en": "Cite at least one chapter span and one outline, lore, or prior-chapter state source."
          },
          "minimum_count": 2,
          "accepted_sources": ["manuscript", "outline", "lore", "review_artifact"]
        },
        "value_contract": {
          "type": "enum",
          "allowed_values": ["normal", "strict"],
          "unknown_value_policy": "reject_explicitly"
        },
        "allowed_override_scopes": ["project", "task", "operation_confirmation"]
      },
      {
        "id": "qg.serial.chapter_end_momentum",
        "contract": { "kind": "denova.quality-goal", "version": "v1" },
        "description": {
          "zh-CN": "第 12 章结尾形成明确推进与继续阅读动力。",
          "en": "Chapter 12 ends with concrete progress and momentum to continue reading."
        },
        "source": {
          "source_id": "profile-long-serial-v1",
          "source_kind": "profile_contract",
          "source_ref": "ADR-PROFILE-001#long-serial",
          "observed_at": "2026-07-21",
          "effective_from": "2026-07-21",
          "recorded_at": "2026-07-21T09:10:00+08:00"
        },
        "purpose": {
          "zh-CN": "让本章完成自身推进，同时为下一章留下有依据的动力。",
          "en": "Complete meaningful chapter progress while leaving grounded momentum for the next chapter."
        },
        "scope": {
          "profile_ids": ["long_serial"],
          "operation_ids": ["draft_chapter_12"],
          "artifact_types": ["chapter_draft"]
        },
        "priority": "should",
        "evidence_requirement": {
          "kind": "text_span",
          "description": {
            "zh-CN": "引用至少一处章末推进或悬念文本。",
            "en": "Quote at least one ending span that demonstrates progress or grounded suspense."
          },
          "minimum_count": 1,
          "accepted_sources": ["manuscript", "review_artifact"]
        },
        "value_contract": {
          "type": "enum",
          "allowed_values": ["medium", "high"],
          "unknown_value_policy": "reject_explicitly"
        },
        "allowed_override_scopes": ["project", "task", "operation_confirmation"]
      }
    ],
    "layers": {
      "profile_defaults": [
        {
          "goal_id": "qg.serial.continuity",
          "value": "normal",
          "provenance": {
            "source_id": "profile-long-serial-v1",
            "source_kind": "profile_contract",
            "source_ref": "long_serial default",
            "observed_at": "2026-07-21",
            "effective_from": "2026-07-21",
            "recorded_at": "2026-07-21T09:10:00+08:00"
          },
          "author_override_policy": {
            "allowed": true,
            "allowed_scopes": ["project", "task", "operation_confirmation"],
            "requires_explicit_confirmation": true,
            "forbidden_operations": ["delete"],
            "unsupported_value_policy": "reject_explicitly"
          }
        },
        {
          "goal_id": "qg.serial.chapter_end_momentum",
          "value": "medium",
          "provenance": {
            "source_id": "profile-long-serial-v1",
            "source_kind": "profile_contract",
            "source_ref": "long_serial default",
            "observed_at": "2026-07-21",
            "effective_from": "2026-07-21",
            "recorded_at": "2026-07-21T09:10:00+08:00"
          },
          "author_override_policy": {
            "allowed": true,
            "allowed_scopes": ["project", "task", "operation_confirmation"],
            "requires_explicit_confirmation": true,
            "forbidden_operations": ["delete"],
            "unsupported_value_policy": "reject_explicitly"
          }
        }
      ],
      "project_overrides": [
        {
          "goal_id": "qg.serial.continuity",